id,title,provider,logoUrl,category,duration,rating,description,tags,status,provider_id
f1e2d3c4-b5a6-7890-1234-f1e2d3c4b5a6,"Advanced React Patterns",InnovateTech,https://i.pravatar.cc/150?u=innovatetech,"Web Development","6 Weeks",4.8,"Master advanced React concepts like hooks, context, and performance optimization.","{React,Frontend,Web Development}","Active",5e9b3a3b-2b4b-4b2b-8c2b-3a2b4b2b2b2b
e2d3c4b5-a6f7-8901-2345-e2d3c4b5a6f7,"Python for Data Science",InnovateTech,https://i.pravatar.cc/150?u=innovatetech,"Data Science","8 Weeks",4.9,"An in-depth course on using Python for data analysis and visualization with libraries like Pandas and Matplotlib.","{Python,Data Science,Pandas}","Active",5e9b3a3b-2b4b-4b2b-8c2b-3a2b4b2b2b2b
d3c4b5a6-f7e8-9012-3456-d3c4b5a6f7e8,"UI/UX Design Fundamentals",InnovateTech,https://i.pravatar.cc/150?u=innovatetech,"Design","4 Weeks",4.7,"Learn the core principles of user interface and user experience design, from wireframing to prototyping.","{UI,UX,Figma,Design}","Active",5e9b3a3b-2b4b-4b2b-8c2b-3a2b4b2b2b2b
c4b5a6f7-e8d9-0123-4567-c4b5a6f7e8d9,"Introduction to Product Management",InnovateTech,https://i.pravatar.cc/150?u=innovatetech,"Product Management","6 Weeks",4.6,"Understand the full product lifecycle, from ideation to launch and iteration.","{Product Management,Agile}","Inactive",5e9b3a3b-2b4b-4b2b-8c2b-3a2b4b2b2b2b
b5a6f7e8-d9c0-1234-5678-b5a6f7e8d9c0,"Backend Development with Node.js",InnovateTech,https://i.pravatar.cc/150?u=innovatetech,"Web Development","10 Weeks",4.8,"Build robust and scalable server-side applications with Node.js and Express.","{Node.js,Backend,JavaScript}","Active",5e9b3a3b-2b4b-4b2b-8c2b-3a2b4b2b2b2b
