id,title,organization_id,location,duration,description,tags,status,stipend
"a1b2c3d4-e5f6-a7b8-c9d0-e1f2a3b4c5d6","Software Engineer Intern","c8b2a3a5-1d4a-4b8e-8e3c-2f9a9b7e1b3a","Remote","12 Weeks","Work on cutting-edge AI projects and collaborate with senior engineers to develop scalable software solutions. This is a great opportunity to gain hands-on experience.","{AI,Python,React,Node.js}","Active",3000
"b2c3d4e5-f6a7-b8c9-d0e1-f2a3b4c5d6e7","Data Scientist Intern","e2a7b1c3-0f4d-4a8a-9c3d-8f8a2b1c3d4e","New York, NY","10 Weeks","Analyze large datasets to extract meaningful insights. Work with our data science team on predictive modeling and data visualization projects.","{""Data Science"",Python,SQL,Tableau}","Active",3500
"c3d4e5f6-a7b8-c9d0-e1f2-a3b4c5d6e7f8","UX/UI Design Intern","c8b2a3a5-1d4a-4b8e-8e3c-2f9a9b7e1b3a","San Francisco, CA","12 Weeks","Design intuitive and engaging user interfaces for our web and mobile applications. Create wireframes, mockups, and prototypes.","{UX,UI,Figma,""Design Thinking""}","Closed",2800
"d4e5f6a7-b8c9-d0e1-f2a3-b4c5d6e7f8a9","Product Manager Intern","e2a7b1c3-0f4d-4a8a-9c3d-8f8a2b1c3d4e","Remote","16 Weeks","Define product roadmaps, work with engineering and design teams to launch new features, and analyze market trends.","{""Product Management"",Agile,JIRA}","Active",3200
"e5f6a7b8-c9d0-e1f2-a3b4-c5d6e7f8a9b0","Marketing Intern","c8b2a3a5-1d4a-4b8e-8e3c-2f9a9b7e1b3a","Austin, TX","12 Weeks","Develop and execute marketing campaigns, manage social media channels, and create engaging content to drive brand awareness.","{Marketing,SEO,""Content Creation""}","Active",2500
